 6665 ; Модель. Lotus  Esprit Turbo. ;  ;  ;  ;  ; 35 ; aurin1 ; 714 
 6666 ; Александр Дюма. "Взятие Бастилии". 130х190 мм. 502 стр ;  ;  ;  ;  ; 26 ; Икстаб ; 567 
 6667 ; Александр Дюма. "Паж герцога Савойского". 130х190 мм. 342 стр ;  ;  ;  ;  ; 24 ; Fortyna 12 ; 455 
 6668 ; Александр Дюма. "Черный тюльпан". 100х155 мм. 332 стр ;  ;  ;  ;  ; 28 ; flutter ; 507 
 6669 ; Александр Дюма. "Ожерелье королевы". 100х155 мм. 380 стр ;  ;  ;  ;  ; 23 ; Икстаб ; 567 
 6670 ; Я.К. Грот "Екатерина II в переписке с Гриммом". СПб. 1884 год. 786 стр. Часть листа отсутствует ;  ;  ;  ;  ; 122 ; jbl ; 2607 
 6671 ; "Избранные лирические произведения КР" В.К. Константина Константиновича. 1915 год. 78 стр ;  ;  ;  ;  ; 33 ; Fortyna 12 ; 920 
 6672 ; Французы в России. Часть III. Москва. 1912 год. 388 стр ;  ;  ;  ;  ; 76 ; giwi ; 1133 
 6673 ; В.А. Арцимович. Воспоминания - Характеристики. 1904 год. 824 стр ;  ;  ;  ;  ; 58 ; Fortyna 12 ; 1134 
 6674 ; Поволжье. Справочник-Путеводитель. Москва. 1932 год. 336 стр ;  ;  ;  ;  ; 20 ; Андрей/Пермь ; 141 
 6675 ; Кристофер Хара. "Боярд. Добрый рыцарь". Много цветных иллюстраций. 133х180 мм. 128 стр ;  ;  ;  ;  ; 36 ; PhantomX25 ; 896 
 6676 ; Чарльз Диккенс. "Большие надежды". 110х160 мм. 492 стр ;  ;  ;  ;  ; 32 ; flutter ; 420 
 6677 ; Чарльз Диккенс. "Лавка древностей". 105х160 мм. 576 стр ;  ;  ;  ;  ; 15 ; flutter ; 306 
 6678 ; "Памятник искусств". СПб . Отсутствует последняя глава ;  ;  ;  ;  ; 3 ; алкид ; 300 
 6679 ; Лот из двух книг. Популярно-научный и литературный сборник "Знание и польза". Книга 1-6 (1904-1906 года) и книга 7-12 (1906 год) ;  ;  ;  ;  ; 39 ; $круджЪ ; 2403 
 6680 ; Лот из 3-х книг. М. Горький, А. Чаковский, А.С. Пушкин ;  ;  ;  ;  ; 31 ; Meshok ; 101 
 6681 ; Ноты Боевые номера Сильва. ;  ;  ;  ;  ; 11 ; Вадя ; 79 
 6682 ; Ноты Романсы и Песни К.Ю. Давыдова. ;  ;  ;  ;  ; 15 ; kaa123 ; 107 
 6683 ; Ноты Хвалебная песнь А.С. Пушкину. ;  ;  ;  ;  ; 4 ; Инструктор ; 96 
 6684 ; Ноты Ночь тепла и волшебная светит луна. ;  ;  ;  ;  ; 5 ; Инструктор ; 106 
 6685 ; Ноты Романс Въ лъсу. ;  ;  ;  ;  ; 3 ; Инструктор ; 157 
 6686 ; Ноты Песни веселья и грусти цыган. ;  ;  ;  ;  ; 5 ; Инструктор ; 157 
 6687 ; Лот нот 3 шт. ;  ;  ;  ;  ; 3 ; Инструктор ; 209 
 6688 ; Пуговица. Pavillon de Rohan D-30мм ;  ;  ; Ж/м ; VF-XF ; 16 ; спарта ; 230 
 6689 ; Лот винтажных моделей 5 шт. ;  ;  ; Б/м ;  ; 44 ; Логистик ; 1558 
 6690 ; Модель. Scania TL. 1/87.Ограниченное издание. Германия, Herpa. Бокс ; 2000-е гг ;  ;  ;  ; 21 ; hobby19 ; 687 
 6691 ; Модель. Ferrari F50. 1/87. Германия, Herpa. Бокс ; 1990-е гг ;  ;  ;  ; 16 ; hobby19 ; 415 
 6692 ; Модель. Mercedes  Benz SLS AMG Roadster. 1/87. Германия, Herpa. Бокс, коробка ;  ;  ;  ;  ; 18 ; Логистик ; 516 
 6693 ; Модель. Jaguar MK VII. 1/87. Neo. Бокс ;  ;  ; Металл, смола ;  ; 25 ; Логистик ; 567 
 6694 ; Модель. Volkswagen Polo. 1/87. Германия, Herpa ; 1990-е гг ;  ;  ;  ; 15 ; Meshok ; 224 
 6695 ; Модель. БТ-7. РФ. Коробка ; 1990-е гг ;  ;  ;  ; 23 ; ivlian ; 267 
 6615 ; Кольцо серебро. ;  ;  ; Ag925 ;  ; 15 ; круча ; 1111 
 6616 ; Запонки Герб, серебро. ;  ;  ; Ag925 ;  ; 56 ; Tegin67 ; 485 
 6617 ; Ручка перьевая, серебро. Зарасные перья. Финляндия. ;  ;  ; Ag813 ;  ; 52 ; CaesarAugustus ; 1742 
 6618 ; Карандаш  автоматический JMPRESSOR, серебрение. ;  ;  ; Ж/м ;  ; 77 ; аймир ; 1187 
 6619 ; Карандаш  WAHL, серебрение. USA. ;  ;  ; Ж/м ;  ; 39 ; murew ; 578 
 6620 ; Канделябр на 5 свечей, серебрение. Европа. ;  ;  ; Б/м ;  ; 18 ; никсер ; 1925 
 6621 ; Канделябр на 3 свечи, серебрение. Англия. ;  ;  ; Б/м ;  ; 71 ; аймир ; 1778 
 6622 ; Подсвечники 2 шт, серебрение. Англия. ;  ;  ; Б/м ;  ; 42 ; антоша ; 884 
 6623 ; Набор из трех предметов. Сливочник, сахарница, поднос, серебрение. Европа. ;  ;  ; Б/м ;  ; 24 ; SerKon ; 1031 
 6624 ; Шкатулка с ангелом, серебрение. Европа. ;  ;  ; Б/м ;  ; 25 ; rem. ; 357 
 6625 ; Щипцы для сервировки, серебрение. Европа. ;  ;  ; Б/м ;  ; 31 ; антоша ; 937 
 6626 ; Копилка поросенок. Европа. ;  ;  ; Б/м ;  ; 15 ; alapabula ; 512 
 6627 ; Статуэтка фарфор. ЛФЗ. Серия "Гоголевские персонажи". Чичиков. Высота 160 мм ;  ;  ;  ;  ; 41 ; ъъ ; 7007 
 6628 ; Статуэтка фарфор. ЛФЗ. Серия "Гоголевские персонажи". Маниловы. Высота 170 мм ;  ;  ;  ;  ; 54 ; ъъ ; 7469 
 6629 ; Статуэтка фарфор. ЛФЗ. Высота 170 мм ;  ;  ;  ;  ; 71 ; Копеечка ; 7042 
 6630 ; Статуэтка фарфоровая Пушкин за столом, ЛФЗ. ;  ;  ;  ;  ; 32 ; Боня ; 1409 
 6631 ; Наградная чаша для саке, фарфор. Япония. ;  ;  ;  ;  ; 47 ; msmaci ; 1181 
 6632 ; Блюдце фарфор. Германия. ;  ;  ;  ;  ; 14 ; Meshok ; 230 
 6633 ; Икона ковчег, дерево. ;  ;  ;  ;  ; 91 ; mefodin ; 9188 
 6634 ; Икона дерево. ;  ;  ;  ;  ; 99 ; bamia67 ; 6903 
 6635 ; Шлем стальной с подшлемником. ;  ;  ; Ж/м ;  ; 67 ; melkore ; 3400 
 6636 ; Бинокль SIRIUS. 7х50. Япония. В обрезиненном корпусе. Оптика целая, механизм исправен. Лина 160 мм ;  ;  ;  ;  ; 66 ; niger ; 3642 
 6637 ; Бинокль театральный 2,5х24. СССР. Желтый. В оригинальном футляре. Оптика целая, механизмы работают ;  ;  ;  ;  ; 49 ; Лоцман ; 1236 
 6638 ; Бинокль театральный 2,5х24. СССР. Синий. В оригинальном футляре. Оптика целая, механизмы работают ;  ;  ;  ;  ; 32 ; aleks1753 ; 833 
 6639 ; Фотоаппарат Зенит 3М ;  ;  ;  ;  ; 11 ; flutter ; 470 
 6640 ; Фотоаппарат BILLY RECORD ;  ;  ;  ;  ; 47 ; lori ; 1237 
 6641 ; Конфетница Ленинград, мельхиор. ;  ;  ; Б/м ;  ; 18 ; Grey 13 ; 651 
 6642 ; Барельеф на стену Данте и Беатриче. Европа ;  ;  ; Б/м ;  ; 8 ; жених ; 126 
 6643 ; Шильдик от музыкального инструмента "М". ;  ;  ; Ж/м ;  ; 13 ; Fest ; 65 
 6644 ; Шильдик от музыкального инструмента. Братья Сарантиди. Екатеринодаръ. ;  ;  ;  ;  ; 31 ; RAPAN ; 93 
 6645 ; Компас карманный в оригинальном деревянном футляре. Первая треть ХХ века. В рабочем состоянии. 50х54 мм ;  ;  ;  ;  ; 42 ; russland ; 1934 
 6646 ; Часы карманные МОЛНИЯ. Сказ об Урале. СССР. С оригинальной цепочкой. Мельхиор. На ходу. Диаметр 50 мм ;  ;  ;  ;  ; 31 ; Русские не сдаются ; 1373 
 6647 ; Часы настольные CONTACT. USA ;  ;  ;  ;  ; 39 ; PhantomX25 ; 1000 
 6648 ; Нож перочинный Victorinox. Швейцария. ;  ;  ; Ж/м ;  ; 64 ; Lektor178 ; 1501 
 6649 ; Часы наручные CERTINA. Швейцария. ;  ;  ; Ж/м ;  ; 25 ; ВЕПРЬ ; 340 
 6650 ; Часы наручные ВОСТОК. С браслетом. Диаметр 38 мм. На ходу ;  ;  ;  ;  ; 17 ; varelgi ; 340 
 6651 ; Часы наручные РАКЕТА. С браслетом. 32х40 мм ;  ;  ;  ;  ; 23 ; CoinM ; 153 
 6652 ; Линейка круговая логарифмическая. КЛ-1. 1968 год. В оригинальном футляре. Паспорт. Диаметр 50 мм ;  ;  ;  ;  ; 35 ; Логистик ; 618 
 6653 ; Радиоприёмный сувенирный ОЛИМПИК ;  ;  ;  ;  ; 9 ; cunde42 ; 255 
 6654 ; Лот пионерской атрибутики: Галстук пионерский, 1991.: Пилотка шелковая, раз.54, 1987, Ремень с эмблемой ;  ;  ;  ;  ; 64 ; PhantomX25 ; 1479 
 6655 ; Лот пионерской атрибутики: Флаг "Пионерский орядный" 60*45см 1988, Галстук пионерский, 1991 ;  ;  ;  ;  ; 53 ; Flak16 ; 1224 
 6656 ; Флюорит. Полированная с одной стороны горбушка. ;  ;  ;  ;  ; 50 ; Ибранец ; 1054 
 6657 ; Малахит. Полированный с одной стороны. ;  ;  ;  ;  ; 53 ; Ибранец ; 2658 
 6658 ; Кварц двух генераций окрашенный гематитом. ;  ;  ;  ;  ; 17 ; Ибранец ; 597 
 6659 ; Кварц двух генераций окрашенный гематитом. ;  ;  ;  ;  ; 30 ; Ибранец ; 404 
 6660 ; Горный хрусталь. ;  ;  ;  ;  ; 37 ; Ибранец ; 1325 
 6661 ; Агат.  Полированная с одной стороны горбушка. ;  ;  ;  ;  ; 35 ; Ибранец ; 1145 
 6662 ; Дымарь-морион. ;  ;  ;  ;  ; 57 ; Ибранец ; 949 
 6663 ; Дымчатый кварц. ;  ;  ;  ;  ; 28 ; Ибранец ; 1008 
 6664 ; Оловянный солдатик Горец. Основание камень. ;  ;  ;  ;  ; 44 ; Ибранец ; 908 
 6422 ; Каталог-справочник. Монеты РСФСР, СССР и России 1921–2021 годов. Редакция 49, 2020 год ;  ;  ;  ;  ; 20 ; Angstrem ; 197 
 6423 ; Каталог-справочник. Монеты РСФСР, СССР и России 1921–2021 годов. Редакция 49, 2020 год ;  ;  ;  ;  ; 17 ; АлексейЕ ; 177 
 6424 ; Каталог-справочник "Бумажные деньги России". Часть II. Редакция 8, 2015 год ;  ;  ;  ;  ; 9 ; alenka1991 ; 139 
 6425 ; Каталог-справочник. Награды Российской Империи. Часть I. Ордена и знаки отличия. Редакция 5 ;  ;  ;  ;  ; 3 ; бортик ; 81 
 6426 ; Каталог-справочник «Монеты Казахстана 1993 – 2021 гг.», 5-я редакция ;  ;  ;  ;  ; 45 ; js ; 134 
 6427 ; Каталог-справочник. Монеты Украины 1992-2013 гг. Редакция 5, 2013 год ;  ;  ;  ;  ; 9 ; VAZ-2107 ; 58 
 6428 ; Каталог-справочник "Бумажные деньги России". Часть I. Редакция 8, 2008 год ;  ;  ;  ;  ; 34 ; VAZ-2107 ; 61 
 6429 ; Хр. Гиль и А. Ильин. Русские монеты с 1801-1904 гг. Репринтное издание ;  ;  ;  ;  ; 6 ; CoinM ; 115 
 6430 ; Каталог-справочник. Монеты РСФСР, СССР и России 1921-2014 годов, 38 редакция ;  ;  ;  ;  ; 14 ; VAZ-2107 ; 65 
 6431 ; А.В. Орешников. Русские монеты до 1547 года. Репринтное издание ;  ;  ;  ;  ; 15 ; $круджЪ ; 666 
 6432 ; Фалеристика всесоюзного студенческого отряда. Санкт-Петербург "Александр ПРИНТ" 2009 ;  ;  ;  ;  ; 34 ; murew ; 413 
 6433 ; Лот из трех карт Польских городов ;  ;  ;  ;  ; 9 ; bobbar ; 29 
 6434 ; М.М. Глейзер. Нумизматы  Санкт-Петербурга-Петрограда-Ленинграда-Санкт-Петербурга. Публикации XX-XXI веков. Санкт-Петербург 2020г ;  ;  ;  ;  ; 17 ; himak ; 428 
 6435 ; Павлов Л.П. Репринтное издание. Нумизматические таблицы (с рисунками) к собиранию редких монет: медных, серебряных, золотых и платиновых с 1425 по 1916 г. ;  ;  ;  ;  ; 20 ; МАХАЙРА ; 159 
 6436 ; Каталог монет Италии. GIGANTE 2021. 29 edizione. ;  ;  ;  ;  ; 51 ; Valeev ; 2595 
 6437 ; В.В. Зайцев. Монеты Ивана Андреевича Можайского и Михаила Андреевича Верейского. Москва 2012 ;  ;  ;  ;  ; 57 ; ask ; 1212 
 6438 ; В.М. Потин. Очерки нумизматики. Монеты клады, коллекции". Санкт-Петербург 1993г. ;  ;  ;  ;  ; 48 ; Affliction ; 555 
 6439 ; Ведомости по знаку отличия Ордена Св. Анны 1864-1913гг. ;  ;  ;  ;  ; 40 ; Valeev ; 3219 
 6440 ; В. Ефремов. Флот на меди, никеле, серебре. Москва 1992г. ;  ;  ;  ;  ; 43 ; Markgraf ; 227 
 6441 ; Каталог частной коллекции. Античные монеты и артефакты. Санкт-Петербург 2019 ;  ;  ;  ;  ; 15 ; ask ; 228 
 6442 ; Гомулин Е.В., Ишенин М.А. Капитульные списки пожалованных знаком отличия военного ордена Св. Георгия №№ 2-30000 ;  ;  ;  ;  ; 44 ; Vladzers ; 2448 
 6443 ; Пухов Е.В. Монета "Ефимок с признаком" ;  ;  ;  ;  ; 17 ; Ertyui ; 185 
 6444 ; И.Г. Спасский "Иностранные и русские ордена до 1917 года". Санкт-Петербург 1993г. ;  ;  ;  ;  ; 31 ; $круджЪ ; 392 
 6445 ; В.В Уздеников. Объем чеканки Российских монет 1700-1917гг. Москва 1995г. ;  ;  ;  ;  ; 35 ; vadimex ; 641 
 6446 ; Русский музей. Каталог выставки "Копейка рубль бережет"+ приглашение на открытие выставки. Упаковка ;  ;  ;  ;  ; 21 ; Aurum ; 793 
 6447 ; Каталог ЕВРО. Монеты и банкноты 2014. Leuchtturn ;  ;  ;  ; Б/у ; 50 ; ortodont2002 ; 235 
 6448 ; Н.Н. Гладков. История государства Российского в наградах и знаках. Том1 ;  ;  ;  ;  ; 10 ; msmaci ; 340 
 6449 ; Нумизматика и эпиграфика. Сборник научных трудов. Том XV. Москва 1989г. ;  ;  ;  ;  ; 46 ; Карл Бенц ; 691 
 6450 ; Деньги лучшее из лучших. Москва 2015г. ;  ;  ;  ;  ; 37 ; К 215 ; 347 
 6451 ; Материалы и исследования отдела нумизматики. По материалам Международной конференции "Два века мусульманской нумизматики в России. Итоги и перспективы". Санкт-Петербург 2017г. ;  ;  ;  ;  ; 68 ; Карл Бенц ; 1003 
 6452 ; Оптовый лот, 20 книг. Каталог-справочник. Монеты РСФСР, СССР и России 1921–2021 годов. Редакция 49, 2020 год ;  ;  ;  ;  ; 70 ; garikms ; 2094 
 6453 ; Оптовый лот, 10 книг.  Монеты России 1700-1917 гг. Редакция 15, 2018 год ;  ;  ;  ;  ; 40 ; альф13 ; 539 
 6454 ; Оптовый лот, 52 книги (коробка). Псевдонимы российского рубля ;  ;  ;  ;  ; 5 ; zabor ; 363 
 6455 ; Оптовый лот. 7 книг (коробка).  В.Е. Семенов. Монетный передел 1700-1917 гг ;  ;  ;  ;  ; 29 ; zabor ; 1720 
 6456 ; Оптовый лот, 20 книг (коробка). Подделки российских монет. В. Е. Семенов ;  ;  ;  ;  ; 42 ; garikms ; 4174 
 6457 ; Оптовый лот. 10 книг. Русские деньги X-XVII вв. Редакция 7, 2019. В. Е. Семенов ;  ;  ;  ;  ; 8 ; альф13 ; 616 
 6601 ; Цепочка золото, плетение Нона. ;  ;  ; Au585 ;  ; 48 ; Рамзес2 ; 19486 
 6602 ; Часы каретные  Angelus с боем. Европа. ;  ;  ; Ж/м ;  ; 47 ; domenica ; 26000 
 6603 ; Подстаканник Русский стиль, серебро 84, ХМП, №1.395. ;  ;  ; Ag84 ;  ; 86 ; ksnab ; 16300 
 6604 ; Ситечко серебро 84, АШ1893 ;  ;  ; Ag84 ;  ; 41 ; com ; 5908 
 6605 ; Две стопки, серебро. ;  ;  ; Ag916 ;  ; 41 ; NANDRE ; 4176 
 6606 ; Часы карманные REMONTOIR серебро, в оригинальном футляре. Швейцария. ;  ;  ; Ag800 ;  ; 31 ; круча ; 11220 
 6607 ; Часы карманные Laverna, серебро. Европа. ;  ;  ; Ag800 ;  ; 26 ; круча ; 8835 
 6608 ; Часы карманные POLHEM, серебро. Швейцария. ;  ;  ; Ag800 ;  ; 45 ; круча ; 12293 
 6609 ; Шатлен для часов с компасом. Европа. ;  ;  ; Ж/м ;  ; 59 ; niger ; 3449 
 6610 ; Шильдик на древко знамени. Певческое общество г.Кирхенберг, серебро. Германия. ;  ;  ; Ag800 ;  ; 34 ; папашаГарпагон ; 983 
 6611 ; Ложка чайная, герб Осло, серебро. Норвегия. ;  ;  ; ag925 ;  ; 34 ; Tegin67 ; 801 
 6612 ; Ложка чайная серебро. Европа ;  ;  ; Ag830 ;  ; 45 ; Tegin67 ; 718 
 6613 ; Ложка чайная серебро. Европа ;  ;  ; Ag830 ;  ; 22 ; Tegin67 ; 672 
 6614 ; Наперсток серебро. Финляндия. ;  ;  ; Ag813 ;  ; 57 ; барсук ; 1393 
 6321 ; Почтовая карточка. Москва ;  ;  ;  ;  ; 28 ; flutter ; 608 
 6322 ; Почтовая карточка. " Адмирал Макаров" ;  ;  ;  ;  ; 85 ; russland ; 1901 
 6323 ; Почтовая карточка. С.-Петербург ;  ;  ;  ;  ; 45 ; Лефорт ; 555 
 6324 ; Почтовая карточка. Железно-Дорожный мост ;  ;  ;  ;  ; 35 ; oliver ; 850 
 6325 ; Почтовая карточка. Тамбов ;  ;  ;  ;  ; 36 ; Рубляш ; 665 
 6326 ; Почтовая карточка. Омск ;  ;  ;  ;  ; 13 ; barsa15 ; 408 
 6327 ; Почтовая карточка. Крейсер I-го ранга "Варяг" ;  ;  ;  ;  ; 38 ; Serjd ; 748 
 6328 ; Почтовая карточка. "Русский Флот" ;  ;  ;  ;  ; 13 ; RAPAN ; 818 
 6329 ; Почтовая карточка. Сердечный Привет из Рязани ;  ;  ;  ;  ; 73 ; Valera72 ; 1792 
 6330 ; Почтовая карточка. Диканька ;  ;  ;  ;  ; 29 ; Рубляш ; 396 
 6331 ; Почтовая карточка. Вид гор. Вереи ;  ;  ;  ;  ; 23 ; oliver ; 567 
 6332 ; Почтовая карточка ;  ;  ;  ;  ; 56 ; Fortyna 12 ; 531 
 6333 ; Почтовая карточка.Симбирск ;  ;  ;  ;  ; 32 ; Десна ; 414 
 6334 ; Почтовая карточка ;  ;  ;  ;  ; 10 ; Fortyna 12 ; 64 
 6335 ; Почтовая карточка. Лаврская Больница и Богодельня ;  ;  ;  ;  ; 21 ; Fortyna 12 ; 225 
 6336 ; Почтовая карточка. С. Медвед ;  ;  ;  ;  ; 14 ; Fortyna 12 ; 306 
 6337 ; Почтовая карточка. "На помощь жертвам войны" ;  ;  ;  ;  ; 17 ; antiquar ; 408 
 6338 ; Почтовая карточка ;  ;  ;  ;  ; 20 ; Рубляш ; 322 
 6339 ; Почтовая карточка ;  ;  ;  ;  ; 9 ; Рубляш ; 72 
 6340 ; Почтовая карточка. "Песня Кати" ; 1939 ;  ;  ;  ; 15 ; 977 ; 247 
 6341 ; Лот открыток  малого формата в буклете (16 штук, полный комплект) "Оружейная палата" ;  ;  ;  ;  ; 17 ; Логистик ; 261 
 6342 ; Лот открыток в буклете (10 штук, полный комплект) "Конёк- Горбунок ;  ;  ;  ;  ; 47 ; flutter ; 280 
 6343 ; Лот открыток в буклете (12 штук, полный комплект) "Былины ;  ;  ;  ;  ; 32 ; Рубляш ; 102 
 6344 ; Лот почтовых карточек со спецгашением (2 штуки) ;  ;  ;  ;  ; 29 ; Карл Бенц ; 233 
 6345 ; Лот: почтовый конверт и карточка со спецгашением ; 1974 ;  ;  ;  ; 7 ; Карл Бенц ; 114 
 6346 ; Лот  почтовых конвертов со спецгашением  "Антарктида" (4 штуки) ;  ;  ;  ;  ; 8 ; Карл Бенц ; 207 
 6347 ; Лот  почтовых конвертов со спецгашением  "Антарктида"  (5 штук) ;  ;  ;  ;  ; 11 ; Карл Бенц ; 203 
 6348 ; Лот  почтовых конвертов со спецгашением  "Антарктида"  (5 штук) ;  ;  ;  ;  ; 7 ; Карл Бенц ; 163 
 6349 ; Лот  почтовых конвертов со спецгашением  "Антарктида"  (7 штук) ;  ;  ;  ;  ; 9 ; Карл Бенц ; 85 
 6401 ; Картина. В. Орлов. Цветы. Ленинград, 1990 г ;  ;  ;  ;  ; 58 ; PiterJof ; 408 
 6402 ; Картина. В. С. Мурзо. 1950-е годы ;  ;  ;  ;  ; 39 ; alapabula ; 408 
 6403 ; Картина. В. С. Мурзо. 1950-е годы ;  ;  ;  ;  ; 21 ; параскева ; 305 
 6404 ; Картина. В. С. Мурзо. 1950-е годы ;  ;  ;  ;  ; 23 ; параскева ; 435 
 6405 ; Картина. Ф. Бурцев. 1960-е годы ;  ;  ;  ;  ; 33 ; siw03 ; 612 
 6406 ; Картина. Ф. Бурцев. 1960-е годы ;  ;  ;  ;  ; 23 ; Dima72 ; 521 
 6407 ; Картина. Ф. Бурцев. 1960-е годы ;  ;  ;  ;  ; 27 ; krai ; 538 
 6408 ; БАЗОВЫЙ каталог монеты России 1700-1917 гг. Выпуск 2018 год. В. Е. Семенов ;  ;  ;  ;  ; 50 ; silverbob ; 1175 
 6409 ; Монетный передел 1700-1917 гг. В. Е. Семенов ;  ;  ;  ;  ; 25 ; unicorn ; 507 
 6410 ; Куда уходят деньги? В. Е. Семенов ;  ;  ;  ;  ; 15 ; uharius ; 109 
 6411 ; Рюрик и Владимир. Самоучитель по русской истории. Издание 2-ое, дополненное. В. Е. Семенов ;  ;  ;  ;  ; 16 ; unicorn ; 420 
 6412 ; Монетное дело Российской империи. В. Е. Семенов ;  ;  ;  ;  ; 31 ; Valera G ; 390 
 6413 ; Русские деньги X-XVII вв. Редакция 7, 2018 ;  ;  ;  ;  ; 16 ; Russman ; 74 
 6414 ; Русские деньги X-XVII вв. Редакция 7, 2018 ;  ;  ;  ;  ; 17 ; Ertyui ; 73 
 6415 ; Русские деньги X-XVII вв. Редакция 7, 2018 ;  ;  ;  ;  ; 35 ; asnik ; 87 
 6416 ; Монеты России 1700-1917 гг. Редакция 15, 2018 год ;  ;  ;  ;  ; 21 ; $круджЪ ; 73 
 6417 ; Монеты России 1700-1917 гг. Редакция 15, 2018 год ;  ;  ;  ;  ; 15 ; js ; 78 
 6418 ; Монеты России 1700-1917 гг. Редакция 15, 2018 год ;  ;  ;  ;  ; 14 ; Barin13 ; 77 
 6419 ; Каталог-справочник. Монеты РСФСР, СССР и России 1921–2021 годов. Редакция 49, 2020 год ;  ;  ;  ;  ; 46 ; js ; 164 
 6420 ; Каталог-справочник. Монеты РСФСР, СССР и России 1921–2021 годов. Редакция 49, 2020 год ;  ;  ;  ;  ; 47 ; Tall Ships ; 272 
 6421 ; Каталог-справочник. Монеты РСФСР, СССР и России 1921–2021 годов. Редакция 49, 2020 год ;  ;  ;  ;  ; 10 ; Angstrem ; 157 
 6271 ; Почтовая карточка. Крейсер 1-го ранга "Светлана" ;  ;  ;  ;  ; 48 ; IgorPetrov51 ; 1357 
 6272 ; Почтовая карточка ;  ;  ;  ;  ; 33 ; лена ; 357 
 6273 ; Лот почтовых карточек (3 штуки) ;  ;  ;  ;  ; 9 ; nikolas13 ; 75 
 6274 ; Лот почтовых карточек (2 штуки) ;  ;  ;  ;  ; 57 ; Fortyna 12 ; 373 
 6275 ; Лот почтовых карточек "Красный крест" (3 штуки) ;  ;  ;  ;  ; 12 ; Zoltan 333 ; 124 
 6276 ; Лот почтовых карточек (3 штуки) ;  ;  ;  ;  ; 5 ; Zoltan 333 ; 92 
 6277 ; Лот почтовых карточек (4 штуки) ;  ;  ;  ;  ; 10 ; Zoltan 333 ; 126 
 6278 ; Лот писем-конвертов с гашением (6 штук) ;  ;  ;  ;  ; 8 ; cucaracha ; 91 
 6279 ; Почтовая карточка. Pin-Ups Vintage ;  ;  ;  ;  ; 3 ; lenohota ; 140 
