 1014 ; Медаль. 50 лет Московскому метрополитену им. В.И. Ленина. Медальер: В. Косарев. D-60мм ; 1989ЛМД ;  ; Ж/м ; AU ; 12 ; Рубляш ; 424 
 1015 ; Медаль. Петр I - Скульптор К.Б. Растрелли. Русский музей. Медальер: С. Иванов. D-60мм ; ЛМД ;  ; Al ; XF+ ; 9 ; Dmitriy-23 ; 257 
 1016 ; Медаль. Памятники Ленинграда. Памятник Петру I. D-57мм ; ЛМД ;  ; Al ; XF+ ; 35 ; sportmini ; 1003 
 1017 ; Медаль. Зоя Космодемьянская. Медальер: Н.А. Соколов. D-53мм ; 1974ЛМД ;  ; Al ; XF ; 44 ; Dmitriy-23 ; 340 
 1018 ; Медаль. Памятники Ленинграда. Памятник В.И.Ленину у Смольного. Медальер Корнилов С. D-59мм ; ЛМД ;  ; Al ; XF+ ; 21 ; sportmini ; 1005 
 1019 ; Медаль. 50 лет Стахановскому движению. 1935-1985. Медальер: А. Козлов. D-60мм ; 1989ЛМД ;  ; Ж/м ; AU ; 11 ; Рубляш ; 424 
 1020 ; Медаль. Имя Пушкинского дома в академии наук. 100 лет институту русской литературы. D-39мм ; СПМД ;  ; Ж/м ; Proof ; 15 ; LEXAI ; 1009 
 1021 ; Медаль. Санкт-Петербург. Медальер: Волкова. D-47мм ; ЛМД ;  ; Ж/м ; AU ; 14 ; avers72 ; 451 
 1022 ; Медаль. Санкт-Петербург. Медальер: Волкова. D-47мм ; ЛМД ;  ; Ж/м ; AU ; 3 ; LEXAI ; 260 
 1023 ; Медаль 100 лет со дня рождения А.М. Горький (1868-1968). Медальер: Н. Соколов. D-57мм ;  ;  ; Al ; VF ; 29 ; бумбараш ; 104 
 1024 ; Медаль. А.С. Пушкин 1799-1837. Медальер: Н. Носов. D-65мм ; 1987ЛМД ;  ; Al ; XF ; 21 ; Dmitriy-23 ; 402 
 1025 ; Медаль. Амур и Психея. Скульптура Летнего сада. Медальер: С. Иванов. D-50мм ; 2004СПМД ;  ; Б/м ; AU ; 21 ; Krakovjak ; 568 
 1026 ; Медаль школьная "золотая". РСФСР. D-40мм ;  ;  ; Ж/м ; AU ; 21 ; rusin ; 716 
 1027 ; Знак. Венгрия ;  ;  ; Б/м,эмаль ; XF ; 28 ; жених ; 57 
 1028 ; Медаль. Рига 1972г. D-48мм ;  ;  ; Al ; F-VF ; 5 ; мед-ь ; 33 
 1029 ; Медаль. Рижский технический университет. Гимн студента Gaudeamus. D-60мм. Отверстие ;  ;  ; Ж/м ; F-VF ; 13 ; academic80 ; 100 
 1030 ; Медаль. Шопрон. D-90мм Отверстие ;  ;  ; Керамика ; F-VF ; 16 ; academic80 ; 128 
 1031 ; Плакета наградная. Мото-федерация. Серия горных гонок. Швеция. 1965. Р-р:44х62мм ;  ;  ; Ж/м ; XF ; 21 ; 1gold ; 134 
 1032 ; Медаль. Шведский клуб охотничьего собаководства. Основан 13 декабря 1889 года. D-50мм ;  ;  ; Ж/м ; XF- ; 56 ; LEXAI ; 433 
 1033 ; Медаль. Сухтелен Иоганн Петер фон (1751-1836) -русский посланник при Шведском дворе. D-51мм 1822г. ;  ;  ; Br ; XF ; 49 ; avers72 ; 6346 
 1034 ; Медаль наградная. Шведская футбольная федерация. Дивизион V. Серия 1957-58. D-27мм ;  ;  ; Ж/м ; VF+ ; 35 ; ivlian ; 159 
 1035 ; Плакета наградная. Национальная ассоциация "варп" - метание камней. 23.08.1931. Стокгольс. Р-р:32х40мм ;  ;  ; Ж/м ; VF+ ; 95 ; ivlian ; 3538 
 1036 ; Медаль. Футбольный клуб "HJK" 1907. Финляндия. D-37мм ;  ;  ; Ж/м ; XF ; 20 ; АМ579 ; 110 
 1037 ; Медаль. Король Георг V, королева Мэри. В ознаменование королевского визита в Данди (Шотландия) 10 июля 1915. Великобритания. D-31мм ;  ;  ; Ж/м ; VF-XF ; 45 ; Dahan ; 291 
 1038 ; Медаль. Шведская ассоциация фехтования. Предолимпийские соревнования 1932 года. D-34мм ;  ;  ; Ж/м ; AU ; 69 ; doc2 ; 716 
 1039 ; Медаль. Седерманланд - земля дворцов и имений. Нючёпинг-административный центр. Герб. Швеция. 1914. D-43мм ;  ;  ; Ж/м ; XF- ; 19 ; АМ579 ; 207 
 1040 ; Жетон. Альберт Эдельфельт. 1961. Финляндия. D-32мм ;  ;  ; Ж/м ; XF+ ; 8 ; Сына поможет ; 32 
 1041 ; Плакета наградная. Австрия. Атлетический клуб "Sirius". 1948. Штанга. Р-р:45х60мм ;  ;  ; Б/м ; VF-XF ; 31 ; doc2 ; 716 
 1042 ; Знак ГТО СССР 2 ступени №78728 ;  ;  ; Ж/м,эмаль ; VF-XF ; 32 ; Снежный Барс ; 605 
 1043 ; Знак. Армения ;  ;  ; Б/м,эмаль ; XF+ ; 26 ; кравчий ; 105 
 1044 ; Знак. Армения ;  ;  ; Б/м,эмаль ; XF+ ; 20 ; Иван Долгий ; 104 
 1045 ; Знак. Строителю стадиона. Красноярск 1967 ;  ;  ; Al ; XF+ ; 14 ; Иван Долгий ; 34 
 1046 ; Знак. 25 лет Свирской победы. Лодейное поле (1969) ; ЛМД ;  ; Al ; AU ; 24 ; Panzerbus ; 36 
 1047 ; Знак. Армения ;  ;  ; Б/м,эмаль ; XF ; 17 ; кравчий ; 107 
 1048 ; Знак. Армения ;  ;  ; Б/м,эмаль ; XF ; 21 ; кравчий ; 101 
 1049 ; Знак. Международный договор об Антарктиде - 25 лет. (1959-1984) ; ЛМД ;  ; Б/м ; AU ; 19 ; кравчий ; 123 
 1050 ; Знак. ВДПО ;  ;  ; Al ; AU ; 3 ; всыня ; 16 
 1051 ; Знак. Смотр-конкурс спортсооружений 1963 ;  ;  ; Al ; XF+ ; 10 ; Maksss163 ; 11 
 1052 ; Знак. Вертолет МИ ;  ;  ; Ж/м,эмаль ; XF ; 7 ; 1505 ; 18 
 1053 ; Знак. Энергетика. Эксплуатационно-технический узел связи - 10 лет. 1963-1973 ;  ;  ; Al ; XF ; 13 ; серж 78 ; 18 
 1054 ; Знак. ВЛКСМ ; ЛМД ;  ; Ж/м,эмаль ; AU ; 36 ; 67 ; 210 
 1055 ; Знак. 100 лет заводу им. Урицкого 1868-1968 ;  ;  ; Al ; AU ; 14 ; porte33 ; 57 
 1056 ; Знак. Олимпийские игры в Сиднее 2000. Австралия ;  ;  ; Б/м,эмаль ; AU ; 31 ; Иван Долгий ; 108 
 1057 ; Знак. Альпинизм. Тянь-Шань ;  ;  ; Al ; XF+ ; 6 ; никсер ; 16 
 1058 ; Знак. Орден Александра Невского ; ЛМД ;  ; Al ; AU ; 23 ; Вартемяги ; 153 
 765 ; Пул анонимный. Золотая Орда, Сыгнак. Лик солнца ;  ;  ; Cu ; VG ; 26 ; креативчик ; 929 
 766 ; Пул анонимный. Золотая Орда, Сыгнак. Звезда пятилучевая ;  ;  ; Cu ; VG ; 15 ; von_Schwarz ; 433 
 767 ; Пул. Хорезм. Чаготаиды с тамгой дома Кайду. М-1,81гр ;  ;  ; Cu ; VG ; 34 ; lestes ; 352 
 768 ; Пул. Золотая Орда. Розетка ; 16в ;  ; Cu ; VG ; 5 ; aziya11 ; 22 
 769 ; Пул. Золотая Орда, Хан Узбек. Орел ; 14в ;  ; Cu ; F- ; 24 ; баргузин ; 104 
 964 ; Звезда ордена Св. Станислава. Мастерская Альберта Кейбеля. Р-ры: 90х87мм. М-48,63гр ; 1831-1855 ; Станислава ;  ; XF ; 121 ; gelo ; 212242 
 965 ; Медаль в память 25-летия церковно-приходских школ. Имп. Александр III и Николай II 1884-1909гг. D-28мм ;  ;  ; Ag ; XF ; 59 ; Sky2 ; 13047 
 966 ; Жетон В память коронации Александра III D-25мм ;  ;  ; Br ; G ; 45 ; rem. ; 129 
 967 ; Медаль. В память Полтавской битвы 27 июня 1709. D-65,5мм ;  ;  ; Ж/м ; VF ; 72 ; jbl ; 21012 
 968 ; Медаль. В память 50-летия учреждения Российской Академии. D-65мм ;  ;  ; Br ; XF+/AU ; 43 ; kpt ; 12707 
 969 ; Медаль. Чины Министерства Императорского двора и уделов графу Иллариону Ивановичу Воронцову Дашкову. Медальер А. Васютинский. D-66мм ;  ;  ; Ж/м ; VF-XF ; 47 ; gelo ; 6903 
 970 ; Жетон. 1 руб. D-28мм ;  ;  ; Ж/м ; VG ; 48 ; СТРЕЛОК 2 ; 1000 
 971 ; Жетон Сретение Господне. D-39мм ; ММД ;  ; Ж/м ; XF+ ; 31 ; zemlyk2014 ; 160 
 972 ; Монетовидный жетон в память Вл.Кн.Михаила Александровича. 25 копеек В капсуле ;  ;  ; Ag ;  ; 62 ; antonkry ; 2025 
 973 ; Медаль. Санкт-Петербург. Медальер: Волкова. D-47мм. Коробка ; ЛМД ;  ; Ж/м ; AU ; 33 ; avers72 ; 460 
 974 ; Медаль. 270 лет СПБГУ. Медальер: Г. Постников. D-60мм ; 1993ЛМД ;  ; Ж/м ; XF+ ; 19 ; rem. ; 362 
 975 ; Медаль Яхт клуб Балтиец. Кубок Балтийца 1 место 8 группа. D-60мм ;  ;  ; Ж/м ; XF ; 18 ; Петр Шувалов ; 272 
 976 ; Медаль. 150 лет со дня рождения русского художника В. Верещагина. 1842-1992. Медальер: А. Архипов. D-70мм ; ЛМД ;  ; Ж/м ; XF+ ; 25 ; rem. ; 267 
 977 ; Медаль. Вечен ваш подвиг в сердцах поколений грядущих. Памятник защитникам Ленинграда 1941-1944. Медальер: А.К. D-60мм ; ЛМД ;  ; Ж/м ; XF ; 36 ; Anatolij1947 ; 536 
 978 ; Медаль. Выставка ЕСТПП - В действии. Ленинград 1979. Межгосударственные стандарты. D-70мм ;  ;  ; Б/м ; XF ; 27 ; Иван Долгий ; 126 
 979 ; Медаль наградная. Открытый чемпионат СПБ по тяжелой атлетике 2015. Р-р:70х75мм ;  ;  ; Ж/м ; XF ; 30 ; Бруно ; 204 
 980 ; Медаль. Петр I. Петергоф-Петродворец, план парков основан в 1714г. D-65мм. В пластиковой коробке ;  ;  ; Al ; AU ; 15 ; agentvovan ; 53 
 981 ; Медаль. Ленинградский технологический институт им. Ленсовета (1828-1978) . Медальер: Н.А. Соловей. D-65мм ;  ;  ; Ж/м ; XF ; 9 ; Anatolij1947 ; 387 
 982 ; Медаль односторонняя. Милосердие. Медальер С.Иванов. D-57мм ; ЛМД ;  ; Al ; XF ; 59 ; aviator55 ; 106 
 983 ; Медаль. Т. Табидзе. D-60мм ;  ;  ; Al ; XF ; 41 ; LEXAI ; 618 
 984 ; Медаль односторонняя. Беллона. Медальер С.Иванов. D-57мм ; ЛМД ;  ; Al ; XF ; 16 ; LEXAI ; 84 
 985 ; Медаль 20 лет Московскому представительству в/п Медимпэкс D-98мм ;  ;  ; Ж/м ; VF ; 12 ; каррр ; 208 
 986 ; Медаль 900 лет Минску D-69мм ;  ;  ; Ж/м ; XF- ; 11 ; Heawen ; 376 
 987 ; Медаль 60 лет Киргизской ССР Медальер Копотев В.В. D-70мм ; 1984ЛМД ;  ; Ж/м ; XF ; 11 ; кравчий ; 842 
 988 ; Медаль М.И.Калинин Медальер А.Козлов D-65мм ; 1976ЛМД ;  ; Ж/м ; XF- ; 31 ; LEXAI ; 2040 
 989 ; Медаль 500 лет открытия Америки. Колумб Медальер А.Шамаев D-65мм ; 1992ЛМД ;  ; Ж/м ; AU ; 39 ; avers72 ; 2289 
 990 ; Медаль 500 лет открытия Америки. Колумб Медальер А.Шамаев D-65мм ; 1992ЛМД ;  ; Ж/м ; AU ; 44 ; jbl ; 3315 
 991 ; Медаль Севастополь Медальер Никищенко D-60мм ; 1986ЛМД ;  ; Ж/м ; AU ; 36 ; LEXAI ; 833 
 992 ; Медаль International Bridge Festival. Казанский собор  D-60мм ; ЛМД ;  ; Ж/м ; AU ; 16 ; LEXAI ; 739 
 993 ; Медаль Скульптура летнего сада. Архитектура Медальер С.Иванов D-60мм ; ЛМД ;  ; Ж/м ; AU ; 40 ; jbl ; 1926 
 994 ; Медаль International Bridge Festival. Банк D-60мм ; ЛМД ;  ; Ж/м ; AU ; 19 ; Vox ; 931 
 995 ; Медаль International Bridge Festival. Вид площади театра D-60мм ; ЛМД ;  ; Ж/м ; AU ; 12 ; кравчий ; 727 
 996 ; Медаль International Bridge Festival. Мост через Мойку D-60мм ; ЛМД ;  ; Ж/м ; AU ; 15 ; TFort ; 1377 
 997 ; Медаль 100 лет со дня рождения Горький Медальер А.Королюк D-60мм ;  ;  ; Ж/м ; AU ; 14 ; O.Krit ; 509 
 998 ; Медаль Скульптура летнего сада. Нимфа Летнего сада Медальер С.Иванов D-60мм ; ЛМД ;  ; Ж/м ; AU ; 26 ; Тульма ; 859 
 999 ; Медаль Франциско Гойя Медальер И.Дараган D-60мм ; 1982ЛМД ;  ; Ж/м ; AU ; 11 ; LEXAI ; 710 
 1000 ; Медаль С.Киров Медальер Королюк D-60мм ; 1972ЛМД ;  ; Ж/м ; AU ; 34 ; O.Krit ; 1486 
 1001 ; Медаль. Ворошиловградская область. D-60мм ;  ;  ; Al ; VF+ ; 8 ; Meshok ; 125 
 1002 ; Медаль. Слава Труду ветеран. Завод. № 85ГА. D-50мм ;  ;  ; Ж/м ; VF-XF ; 13 ; каррр ; 58 
 1003 ; Медаль. Дворец спорта СКА 10 лет. D-51мм ;  ;  ; Al ; XF ; 31 ; Приключения Кати ; 153 
 1004 ; Медаль. Я.В. Виллие. 1768-1854. Военная медицина России. Медальер: А. Шамаев. D-65мм ; 1993ЛМД ;  ; Ж/м ; AU ; 25 ; LEXAI ; 2789 
 1005 ; Медаль. Холо Грэйт. 10 лет. Санкт-Петербург 2001г. D-60мм ;  ;  ; Ж/м ; VF ; 3 ; мед-ь ; 105 
 1006 ; Медаль. Медный всадник. D-55мм ;  ;  ; Al ; VF+ ; 11 ; Meshok ; 75 
 1007 ; Медаль. Пятигорск-Всесоюзная здравница (1780-1980гг). D-54мм ;  ;  ; Al ; VF ; 3 ; мед-ь ; 58 
 1008 ; Медаль. Игры доброй воли Санкт-Петербург №278 S046. D-48мм ;  ;  ; Б/м ; F ; 15 ; каррр ; 101 
 707 ; Копейка. Подделка. Медь, плакированная белым металлом. М-0,24гр ;  ; Петр Алексеевич ; Cu, плакировка ; F- ; 32 ; kaso2008 ; 184 
 708 ; Лот монет Петра I (10шт): копейка ; 1682-1725 ;  ; Ag ; F-VF/VF ; 22 ; zemlyk2014 ; 439 
 709 ; Лот монет Михаила Федоровича (3шт): копейка ; 1613-1645 ;  ; Ag ; F/F+ ; 9 ; zemlyk2014 ; 90 
 710 ; Лот монет Ивана Грозного, Федора Ивановича и Бориса Годунова (6шт): копейка ;  ;  ; Ag ; F/F-VF ; 21 ; Usinsk ; 318 
 711 ; Лот монет Ивана Грозного (6шт): денга ; 1533-1584 ;  ; Ag ; F ; 24 ; zemlyk2014 ; 271 
 712 ; Лот монет Ивана Грозного, Федора Ивановича и Бориса Годунова (6шт): копейка ;  ;  ; Ag ; F/F-VF ; 19 ; zemlyk2014 ; 283 
 721 ; Центенионалий. Александрия. Имп. Констанций II. Римский солдат поражает вражеского всадника. М-4,51гр ; 351-355 ;  ; Cu ; F+ ; 24 ; smel ; 509 
 722 ; Дирхем. Аббасиды. Харун ар-Рашид. М-2,88гр ; 170-193 г.х. ;  ; Ag ; VF ; 31 ; Ravak_1981 ; 1326 
 723 ; Дирхем. Восток. Отверстие. М-2,76гр ; 9-10вв ;  ; Ag ; VF ; 36 ; academic80 ; 545 
 724 ; Дирхем. Сельджуки Рума. Кей Хосров III. М-2,97гр ; 663-682 г.х. ;  ; Ag ; F-VF ; 30 ; vonrussel ; 830 
 725 ; Драхма. Сасаниды, г. Хармизд-Арашир. Монетный двор : AW. Йездигерд I. D-30мм. М-4,33гр ; 399-420 г.х. ;  ; Ag ; XF ; 47 ; sax ; 3463 
 726 ; Монета. Золотая Орда, Сыгнак. Хан Урус ; 775 г.х. ;  ; Ag ; F+ ; 17 ; Cherpoy ; 8169 
 727 ; Монета. Золотая Орда, Сарай. Хан Узбек ; 727 г.х. ;  ; Ag ; F ; 29 ; Бигль ; 213 
 728 ; Монета. Золотая Орда, Хорезм. Хан Бердибек ; 760 г.х. ;  ; Ag ; F+ ; 15 ; Кронштадт ; 567 
 729 ; Монета. Золотая Орда, Кафа. Хан Шадибек ; 807 г.х. ;  ; Ag ; F ; 53 ; Бигль ; 312 
 730 ; Монета. Золотая Орда, Хан Хызр с надчеканом "адиль" ; 762 г.х. ;  ; Ag ; F ; 19 ; zoom30 ; 929 
 731 ; Монета. Золотая Орда, Гюлистан. Хан Джанибек ; 752 г.х. ;  ; Ag ; F+ ; 16 ; aziya11 ; 302 
 732 ; Монета. Золотая Орда, Сад. Хан Джанибек с мусульманским именем Махмуд ; 74? Г.х. ;  ; Ag ; F+ ; 41 ; trast ; 320 
 733 ; Монета. Золотая Орда, Сад. Хан Джанибек. Коронационный чекан ; 743 г.х. ;  ; Ag ; F+ ; 11 ; sinus ; 1007 
 734 ; Монета. Золотая Орда, Сад. Хан Джанибек. С уйгурской надписью ; 743 г.х. ;  ; Ag ; F+ ; 35 ; oliver ; 634 
 735 ; Монета. Золотая Орда, Сад. В квадратном картуше ; 751 г.х. ;  ; Ag ; F+ ; 37 ; mokscha ; 783 
 736 ; Монета. Золотая Орда, Сарай. Хан Тула-Буга. С тамгой дома Бату и Калимой ; 13в ;  ; Ag ; VF ; 24 ; креативчик ; 2298 
 737 ; Монета. Золотая Орда, Булгар. Хан Бату с именем Ан-Насир ; 13в ;  ; Ag ; F ; 33 ; креативчик ; 1383 
 738 ; Монета. Золотая Орда, Булгар. Хан Берке ; 13в ;  ; Ag ; F- ; 35 ; креативчик ; 442 
 739 ; Монета. Золотая Орда, Булгар. Хан Токта. Лев и солнце ; 13в ;  ; Ag ; F- ; 26 ; mokscha ; 2440 
 740 ; Монета. Золотая Орда, Сарай ал Махруса. Хан Токта ; 722 г.х. ;  ; Ag ; F- ; 21 ; Кронштадт ; 374 
 741 ; Монета. Золотая Орда, Сад. Хан Науруз ; 761 г.х. ;  ; Ag ; F+ ; 23 ; von_Schwarz ; 556 
 742 ; Монета. Золотая Орда. Хан Кильдибек ; 762 г.х. ;  ; Ag ; F+ ; 42 ; креативчик ; 1154 
 743 ; Монета. Золотая Орда, Гюлистан. Хан Мюрид ; 763 г.х. ;  ; Ag ; VF- ; 23 ; креативчик ; 778 
 744 ; Монета. Золотая Орда, Азак. Хан Бердибек ; 760 г.х. ;  ; Ag ; F ; 33 ; креативчик ; 678 
 745 ; Монета. Золотая Орда, Азак. Хан Науруз ; 760 г.х. ;  ; Ag ; F ; 42 ; Кронштадт ; 646 
 746 ; Монета. Золотая Орда, Сад. Хан Орду-Мелик ; 762 г.х. ;  ; Ag ; F+ ; 23 ; Кронштадт ; 2302 
 747 ; Монета. Золотая Орда, Хаджи-Тархан ал Джадид. Хан Шадибек ;  ;  ; Ag ; F+ ; 12 ; креативчик ; 793 
 748 ; Монета. Золотая Орда, Орду. Хан Пулад с Калимой ;  ;  ; Ag ; F+ ; 44 ; trast ; 465 
 749 ; Монета. Золотая Орда, Азак. Хан Токта. Треугольник ; 707 г.х. ;  ; Ag ; F ; 26 ; белгород поиск ; 1519 
 750 ; Монета. Золотая Орда, Азак ал-Махруса. Хан Токтамыш ; 793 г.х. ;  ; Ag ; F ; 42 ; aziya11 ; 337 
 751 ; Монета. Закавказье. М-1,34гр ;  ;  ; Ag ; F ; 15 ; aziya11 ; 354 
 752 ; Монета. Золотая Орда, Орду Муаззам. Хан Дервиш ;  ;  ; Ag ; F ; 15 ; Кронштадт ; 567 
 753 ; Данг. Золотая Орда, Урду Муаззам. Хан Тимур бек Тимур-Кутлуг ; 812 г.х. ;  ; Ag ; F+ ; 35 ; Кронштадт ; 713 
 754 ; Данг. Золотая Орда, Закавказье. Хан Токтамыш. С Калимой ;  ;  ; Ag ; F- ; 13 ; von_Schwarz ; 520 
 755 ; Данг. Золотая Орда, Иль Уй Муаззам. Хан Улу Мухаммад ;  ;  ; Ag ; F ; 37 ; A2KOT ; 509 
 756 ; Данг. Золотая Орда, Сарай. Тимур бек Тимур-Кутлуг ;  ;  ; Ag ; F ; 13 ; белгород поиск ; 694 
 757 ; Данг. Золотая Орда, Сад. Джанибек с Уйгурской надписью ; 743 г.х. ;  ; Ag ; F ; 35 ; trast ; 402 
 758 ; Данг. Золотая Орда, Урду с Калимой. Хан Тимур бек Тимур-Кутлуг ; 814 г.х. ;  ; Ag ; F ; 19 ; von_Schwarz ; 542 
 759 ; Монета. Золотая Орда, Орда. Хан Дервиш ;  ;  ; Ag ; F ; 22 ; Кронштадт ; 571 
 760 ; Монета. Золотая Орда, Азак. Хан Ордумелик ; 762 г.х. ;  ; Ag ; F ; 48 ; Кронштадт ; 2121 
 761 ; Монета. Золотая Орда. Сад. Хан Джанибек ; 745 г.х. ;  ; Ag ; F+ ; 23 ; trast ; 200 
 762 ; Монета. Золотая Орда. Сад. Хан Джанибек ; 747 г.х. ;  ; Ag ; VF- ; 47 ; A2KOT ; 368 
 763 ; Монета. Золотая Орда. Белед Сарай. Хан Токтамыш ;  ;  ; Ag ; F+ ; 37 ; Kino70 ; 214 
 764 ; Пул. Золотая Орда, Сыгнак. Время хана Урус. Треугольник ;  ;  ; Cu ; VG ; 43 ; aziya11 ; 317 
 657 ; Денга ; 1584-1598 ; Федор Иванович Блаженный. Московский денежный двор ; Ag ; VF- ; 8 ; Снежный Барс ; 33 
 658 ; Копейка ; 1584-1598 ; Федор Иванович Блаженный. Московский денежный двор ; Ag ; VF+ ; 45 ; petriuspo ; 133 
 659 ; Копейка ; 1584-1598 ; Федор Иванович Блаженный. Новгородский денежный двор ; Ag ; VF-VF ; 25 ; Бигль ; 160 
 660 ; Копейка ; 1584-1598 ; Федор Иванович Блаженный. Новгородский денежный двор ; Ag ; VF ; 35 ; Meshok ; 113 
 661 ; Копейка ; 1584-1598 ; Федор Иванович Блаженный. Новгородский денежный двор ; Ag ; VF ; 18 ; сортам70 ; 88 
 662 ; Копейка ; 1584-1598 ; Федор Иванович Псковский денежный двор ; Ag ; VF- ; 9 ; 1977z ; 59 
 663 ; Копейка ; 1584-1598 ; Федор Иванович Псковский денежный двор ; Ag ; VF- ; 10 ; Бигль ; 44 
 664 ; Копейка ; 1598-1605 ; Борис Федорович Годунов. Московский денежный двор ; Ag ; VF ; 13 ; сортам70 ; 67 
 665 ; Копейка ; 1598-1605 ; Борис Федорович Годунов. Московский денежный двор ; Ag ; VF+ ; 9 ; сортам70 ; 70 
 666 ; Копейка ; 1598-1605 ; Борис Федорович Годунов. Московский денежный двор ; Ag ; VF ; 27 ; 1977z ; 150 
 667 ; Копейка ; 1598-1605 ; Борис Федорович Годунов. Московский денежный двор ; Ag ; VF+ ; 12 ; Kino70 ; 114 
 668 ; Копейка ; 1599 ; Борис Федорович Годунов. Новгородский денежный двор ; Ag ; VF ; 25 ; pavspb ; 567 
 669 ; Копейка ; 1602 ; Борис Федорович Годунов. Новгородский денежный двор ; Ag ; VF ; 35 ; vit2503 ; 170 
 670 ; Копейка ; 1598-1605 ; Борис Федорович Годунов. Псковский денежный двор ; Ag ; F-VF ; 16 ; porte33 ; 60 
 671 ; Копейка ; 1598-1605 ; Борис Федорович Годунов. Псковский денежный двор ; Ag ; VF ; 24 ; sinus ; 218 
 672 ; Копейка. Брак чекана ; 1598-1605 ; Борис Федорович Годунов. Московский денежный двор ; Ag ; F-VF ; 20 ; doc2 ; 102 
 673 ; Копейка. Брак чекана ; 1598-1605 ; Борис Федорович Годунов. Московский денежный двор ; Ag ; VF- ; 19 ; doc2 ; 102 
 674 ; Копейка ; 1618-1630 ; Михаил Федорович. Новгородский денежный двор ; Ag ; F-VF ; 33 ; Бигль ; 101 
 675 ; Копейка. М-0,50гр ; 1613-1645 ; Михаил Федорович. Московский денежный двор ; Ag ; F-VF ; 55 ; f3ar ; 803 
 676 ; Копейка. Брак чекана ; 1613-1645 ; Михаил Федорович. Московский денежный двор ; Ag ; F-VF ; 24 ; f3ar ; 72 
 677 ; Копейка. Брак чекана ; 1613-1645 ; Михаил Федорович. Псковский денежный двор ; Ag ; F+ ; 24 ; Бигль ; 81 
 678 ; Копейка ; 1645-1676 ; Алексей Михайлович. Московский денежный двор ; Ag ; F-VF ; 21 ; cotangens ; 153 
 679 ; Копейка ; 1645-1676 ; Алексей Михайлович. Московский денежный двор ; Ag ; VF- ; 35 ; Kino70 ; 148 
